{
  "$schema": "https://json-schema.org/draft/2020-12/schema",
  "title": "Платформенный конверт события/команды (embedding-service)",
  "type": "object",
  "required": [
    "event_id",
    "event_type",
    "event_version",
    "aggregate_type",
    "occurred_at",
    "producer",
    "data"
  ],
  "properties": {
    "event_id": { "type": "string", "format": "uuid" },
    "event_type": { "type": "string" },
    "event_version": { "type": "string" },
    "aggregate_type": { "type": "string" },
    "aggregate_id": { "type": "string", "format": "uuid" },
    "occurred_at": { "type": "string" },
    "producer": { "type": "string" },
    "trace_id": { "type": "string" },
    "correlation_id": { "type": "string" },
    "data": { "type": "object" }
  }
}
