{
  "event_id": "0192f0c8-9999-7abc-8def-1a2b3c4d5e6f",
  "event_type": "embedding.documents.generated.v1",
  "event_version": "1.0",
  "aggregate_type": "embedding_job",
  "aggregate_id": "0192f0c8-0000-7000-8000-000000000abc",
  "occurred_at": "2026-07-20T10:15:31.456789Z",
  "producer": "embedding-service",
  "trace_id": "00-0af7651916cd43dd8448eb211c80319c-b7ad6b7169203331-01",
  "correlation_id": "c1a2b3c4",
  "data": {
    "request_id": "0192f0c8-0000-7000-8000-000000000abc",
    "model_version": "BAAI/bge-m3@unknown|pool=cls|norm=1|dim=1024",
    "dim": 1024,
    "results": [
      {
        "text_id": "prod-001",
        "status": "ok",
        "dense": [
          -1.0,
          -0.98,
          -0.96,
          -0.94,
          -0.92,
          -0.9,
          -0.88,
          -0.86,
          -0.84,
          -0.82,
          -0.8,
          -0.78,
          -0.76,
          -0.74,
          -0.72,
          -0.7,
          -0.68,
          -0.66,
          -0.64,
          -0.62,
          -0.6,
          -0.58,
          -0.56,
          -0.54,
          -0.52,
          -0.5,
          -0.48,
          -0.46,
          -0.44,
          -0.42,
          -0.4,
          -0.38,
          -0.36,
          -0.34,
          -0.32,
          -0.3,
          -0.28,
          -0.26,
          -0.24,
          -0.22,
          -0.2,
          -0.18,
          -0.16,
          -0.14,
          -0.12,
          -0.1,
          -0.08,
          -0.06,
          -0.04,
          -0.02,
          0.0,
          0.02,
          0.04,
          0.06,
          0.08,
          0.1,
          0.12,
          0.14,
          0.16,
          0.18,
          0.2,
          0.22,
          0.24,
          0.26,
          0.28,
          0.3,
          0.32,
          0.34,
          0.36,
          0.38,
          0.4,
          0.42,
          0.44,
          0.46,
          0.48,
          0.5,
          0.52,
          0.54,
          0.56,
          0.58,
          0.6,
          0.62,
          0.64,
          0.66,
          0.68,
          0.7,
          0.72,
          0.74,
          0.76,
          0.78,
          0.8,
          0.82,
          0.84,
          0.86,
          0.88,
          0.9,
          0.92,
          0.94,
          0.96,
          0.98,
          1.0,
          -1.0,
          -0.98,
          -0.96,
          -0.94,
          -0.92,
          -0.9,
          -0.88,
          -0.86,
          -0.84,
          -0.82,
          -0.8,
          -0.78,
          -0.76,
          -0.74,
          -0.72,
          -0.7,
          -0.68,
          -0.66,
          -0.64,
          -0.62,
          -0.6,
          -0.58,
          -0.56,
          -0.54,
          -0.52,
          -0.5,
          -0.48,
          -0.46,
          -0.44,
          -0.42,
          -0.4,
          -0.38,
          -0.36,
          -0.34,
          -0.32,
          -0.3,
          -0.28,
          -0.26,
          -0.24,
          -0.22,
          -0.2,
          -0.18,
          -0.16,
          -0.14,
          -0.12,
          -0.1,
          -0.08,
          -0.06,
          -0.04,
          -0.02,
          0.0,
          0.02,
          0.04,
          0.06,
          0.08,
          0.1,
          0.12,
          0.14,
          0.16,
          0.18,
          0.2,
          0.22,
          0.24,
          0.26,
          0.28,
          0.3,
          0.32,
          0.34,
          0.36,
          0.38,
          0.4,
          0.42,
          0.44,
          0.46,
          0.48,
          0.5,
          0.52,
          0.54,
          0.56,
          0.58,
          0.6,
          0.62,
          0.64,
          0.66,
          0.68,
          0.7,
          0.72,
          0.74,
          0.76,
          0.78,
          0.8,
          0.82,
          0.84,
          0.86,
          0.88,
          0.9,
          0.92,
          0.94,
          0.96,
          0.98,
          1.0,
          -1.0,
          -0.98,
          -0.96,
          -0.94,
          -0.92,
          -0.9,
          -0.88,
          -0.86,
          -0.84,
          -0.82,
          -0.8,
          -0.78,
          -0.76,
          -0.74,
          -0.72,
          -0.7,
          -0.68,
          -0.66,
          -0.64,
          -0.62,
          -0.6,
          -0.58,
          -0.56,
          -0.54,
          -0.52,
          -0.5,
          -0.48,
          -0.46,
          -0.44,
          -0.42,
          -0.4,
          -0.38,
          -0.36,
          -0.34,
          -0.32,
          -0.3,
          -0.28,
          -0.26,
          -0.24,
          -0.22,
          -0.2,
          -0.18,
          -0.16,
          -0.14,
          -0.12,
          -0.1,
          -0.08,
          -0.06,
          -0.04,
          -0.02,
          0.0,
          0.02,
          0.04,
          0.06,
          0.08,
          0.1,
          0.12,
          0.14,
          0.16,
          0.18,
          0.2,
          0.22,
          0.24,
          0.26,
          0.28,
          0.3,
          0.32,
          0.34,
          0.36,
          0.38,
          0.4,
          0.42,
          0.44,
          0.46,
          0.48,
          0.5,
          0.52,
          0.54,
          0.56,
          0.58,
          0.6,
          0.62,
          0.64,
          0.66,
          0.68,
          0.7,
          0.72,
          0.74,
          0.76,
          0.78,
          0.8,
          0.82,
          0.84,
          0.86,
          0.88,
          0.9,
          0.92,
          0.94,
          0.96,
          0.98,
          1.0,
          -1.0,
          -0.98,
          -0.96,
          -0.94,
          -0.92,
          -0.9,
          -0.88,
          -0.86,
          -0.84,
          -0.82,
          -0.8,
          -0.78,
          -0.76,
          -0.74,
          -0.72,
          -0.7,
          -0.68,
          -0.66,
          -0.64,
          -0.62,
          -0.6,
          -0.58,
          -0.56,
          -0.54,
          -0.52,
          -0.5,
          -0.48,
          -0.46,
          -0.44,
          -0.42,
          -0.4,
          -0.38,
          -0.36,
          -0.34,
          -0.32,
          -0.3,
          -0.28,
          -0.26,
          -0.24,
          -0.22,
          -0.2,
          -0.18,
          -0.16,
          -0.14,
          -0.12,
          -0.1,
          -0.08,
          -0.06,
          -0.04,
          -0.02,
          0.0,
          0.02,
          0.04,
          0.06,
          0.08,
          0.1,
          0.12,
          0.14,
          0.16,
          0.18,
          0.2,
          0.22,
          0.24,
          0.26,
          0.28,
          0.3,
          0.32,
          0.34,
          0.36,
          0.38,
          0.4,
          0.42,
          0.44,
          0.46,
          0.48,
          0.5,
          0.52,
          0.54,
          0.56,
          0.58,
          0.6,
          0.62,
          0.64,
          0.66,
          0.68,
          0.7,
          0.72,
          0.74,
          0.76,
          0.78,
          0.8,
          0.82,
          0.84,
          0.86,
          0.88,
          0.9,
          0.92,
          0.94,
          0.96,
          0.98,
          1.0,
          -1.0,
          -0.98,
          -0.96,
          -0.94,
          -0.92,
          -0.9,
          -0.88,
          -0.86,
          -0.84,
          -0.82,
          -0.8,
          -0.78,
          -0.76,
          -0.74,
          -0.72,
          -0.7,
          -0.68,
          -0.66,
          -0.64,
          -0.62,
          -0.6,
          -0.58,
          -0.56,
          -0.54,
          -0.52,
          -0.5,
          -0.48,
          -0.46,
          -0.44,
          -0.42,
          -0.4,
          -0.38,
          -0.36,
          -0.34,
          -0.32,
          -0.3,
          -0.28,
          -0.26,
          -0.24,
          -0.22,
          -0.2,
          -0.18,
          -0.16,
          -0.14,
          -0.12,
          -0.1,
          -0.08,
          -0.06,
          -0.04,
          -0.02,
          0.0,
          0.02,
          0.04,
          0.06,
          0.08,
          0.1,
          0.12,
          0.14,
          0.16,
          0.18,
          0.2,
          0.22,
          0.24,
          0.26,
          0.28,
          0.3,
          0.32,
          0.34,
          0.36,
          0.38,
          0.4,
          0.42,
          0.44,
          0.46,
          0.48,
          0.5,
          0.52,
          0.54,
          0.56,
          0.58,
          0.6,
          0.62,
          0.64,
          0.66,
          0.68,
          0.7,
          0.72,
          0.74,
          0.76,
          0.78,
          0.8,
          0.82,
          0.84,
          0.86,
          0.88,
          0.9,
          0.92,
          0.94,
          0.96,
          0.98,
          1.0,
          -1.0,
          -0.98,
          -0.96,
          -0.94,
          -0.92,
          -0.9,
          -0.88,
          -0.86,
          -0.84,
          -0.82,
          -0.8,
          -0.78,
          -0.76,
          -0.74,
          -0.72,
          -0.7,
          -0.68,
          -0.66,
          -0.64,
          -0.62,
          -0.6,
          -0.58,
          -0.56,
          -0.54,
          -0.52,
          -0.5,
          -0.48,
          -0.46,
          -0.44,
          -0.42,
          -0.4,
          -0.38,
          -0.36,
          -0.34,
          -0.32,
          -0.3,
          -0.28,
          -0.26,
          -0.24,
          -0.22,
          -0.2,
          -0.18,
          -0.16,
          -0.14,
          -0.12,
          -0.1,
          -0.08,
          -0.06,
          -0.04,
          -0.02,
          0.0,
          0.02,
          0.04,
          0.06,
          0.08,
          0.1,
          0.12,
          0.14,
          0.16,
          0.18,
          0.2,
          0.22,
          0.24,
          0.26,
          0.28,
          0.3,